train_idx,text,label,label_text
2125,5 cheap user replaceable battery 50 creative great advantage ipod battery cost 100 replace,1,positive
2126,music play awesome never skip even u run bit listen music without interruption,1,positive
2127,easy assemble diaper fit perfectly little nook make way pail portion,1,positive
2128,4 attempted installs finally given,0,negative
2129,fourth version systemworks second version internet security used always favorite,1,positive
2130,build quality show cheap small scratch base plate something would n see sony overall plastic feel,0,negative
2131,proprietary headset jack,0,negative
2132,seems focus metering complete quite lag shutter,0,negative
2133,imagine shock absolute instant disdain product made apex,0,negative
2134,found low light situation combined sort action left camera dust,0,negative
2135,speed problem,1,positive
2136,lcd screen pull rotates direction easy picture,1,positive
2137,purchased two player christmas gift bad,0,negative
2138,larger lens g3 give better picture quality low light 4 time optical zoom get much closer,1,positive
2139,player ideal purchase,1,positive
2140,2 4mp right target market camera semi serious amateur photographer,1,positive
2141,great value 40gb v 10 gb ipod price,1,positive
2142,lens cap really annoying,0,negative
2143,white earbuds replaced shire headphone big difference case stand clip really work nice little zen micro bag,1,positive
2144,40gb storage 7 500 song player everything music file room 2 500,1,positive
2145,take excellent photo,1,positive
2146,good balance hand lighter 3 1 4 hp model,1,positive
2147,previous version nortron security system nortron antivirus installation go fine otherwise dig major registery clean old program leave trace mess new installation even uninstalled old program perfectly,0,negative
2148,2 week best player seen used ever,1,positive
2149,overall great value,1,positive
2150,impressed power hitachi m12v,1,positive
2151,creative making computer sound equipment decade zen micro finally something enough quality yes charm win nice size digital player pie,1,positive
2152,easy use yet feature rich,1,positive
2153,click one button router configuration window router automatically sens device configures network,1,positive
2154,compared lot camera believe value money,1,positive
2155,negative impossibly tiny difficult operate barely visible power button,0,negative
2156,downloads snap quick,1,positive
2157,sound exceptional though really compare ipod,1,positive
2158,nikon 4300 feel best camera feature price,1,positive
2159,touch pad would great thing worked well never issue getting song transferred player problem accessing player,0,negative
2160,picture taken dark nice like,0,negative
2161,low light flash found clear better sony p200 much red colour overall natural fewer red eye,1,positive
2162,second digital camera much impressed canon s100 digital elph ever kodak dc240,1,positive
2163,phone obviously quality construction motorola nokia 6600 one better phone used,1,positive
2164,camera easy use,1,positive
2165,diaper champ best found,1,positive
2166,eax equalizer accentuates diminished quality mp3 file,0,negative
2167,basic usage easy remote lot button n used,1,positive
2168,good image quality,1,positive
2169,come tank case cut piece screen always keep case still access everything,1,positive
2170,play basically every medium tested far even old vcd ripped year ago rental dvd could n played old 200 sharp player,1,positive
2171,color light captured camera 12 day trip turkey gorgeous vividly colored ceramic tile inside darkened mosque far superior anything ever gotten traditional 35 mm film camera,1,positive
2172,work minimum fuss,1,positive
2173,got camera unbelievably low price amazon,1,positive
2174,sound quality amazing expecting worse really good especially file good sound quality,1,positive
2175,uploading music quick easy,1,positive
2176,still reading click add cart button already,1,positive
2177,program id3 tag editing strong point well,1,positive
2178,tried e mailing apex come back saying undeliverable,0,negative
2179,first sound quality okay least one reviewer mentioned eax cause audio interference 30 minute,0,negative
2180,although canon battery proprietary last really long time recharge fairly quickly camera plus want power even find knockoff charger spare battery right amazon,1,positive
2181,price along replaceable battery understand apple charge small fortune replace well hassle returning two main factor picked nomad,1,positive
2182,kick butt mp3 machine freedom get song reasonable source instead paying two three time get creative zen ipod killer kiss as itunes,1,positive
2183,got older 866 mhz system 512 pc 133 ram also run fine,1,positive
2184,interface bit confusing first easy navigate 15 minute,1,positive
2185,bit pricey call home country instant messaging covered country europe quite reasonable,1,positive
2186,care sunlight tft,1,positive
2187,press button hard frequently end pressing enter meant scroll,0,negative
2188,power low noise operation speed control make problem experienced,1,positive
2189,product worked perfectly xp,1,positive
2190,great phone traveling world packed wonderful feature,1,positive
2191,affect standard mp3 file subscription wma file,0,negative
2192,bottom line phone cool one moment latest phone market new feature soon displaced upcoming newer phone,1,positive
2193,software somewhat nice look using easiest,0,negative
2194,2 dvd far refuse play certain episode problem others dvd,0,negative
2195,problem router encountered plunge action start stick need cleaned lubricated,0,negative
2196,menu easy navigate,1,positive
2197,plug reveals truly stunning quality raw g3 hardware,1,positive
2198,champ work great,1,positive
2199,replacement battery 50 compared ipod 150,1,positive
2200,mean tech junkie able install able put cd computer tell,1,positive
2201,little camera created marriage nikon never knew could love digital camera much,1,positive
2202,battery life ok,1,positive
2203,would spin read spin show display disc,0,negative
2204,6 gb used ipod far well 1000 song far tell play near cd quality,1,positive
2205,flaw circuit board headphone jack connected,0,negative
2206,player great,1,positive
2207,work great usually full 54 mbps although every drop around 36 mbps 2 floor router,1,positive
2208,finally got working worked properly many month,0,negative
2209,engineer creative screwed design headphone jack,0,negative
2210,fix glitch player freezing,0,negative
2211,bought diaper pail son day old absolutely love,1,positive
2212,oftentimes hard get good grip router activate chuck lock get enough muscle behind wrench get collet loosened,0,negative
2213,cover came n fit well,0,negative
2214,last simpler nokia started right immediately ready use,0,negative
2215,however hard drive fail dropped,0,negative
2216,downloaded new firmware supposed take care problem worked,0,negative
2217,automatically transfer song identical title live album greatest hit album cause inordinate frustration,0,negative
2218,attempting navigate clumsy touch pad system could get unit download wma file,0,negative
2219,fact creative mp3 player software problem first place,0,negative
2220,feel like quality construction n sure long would last,0,negative
2221,menu option appear one time taking whole screen one scroll one one memorized menu order select using number keypad,0,negative
2222,dont use belt clip cz fails hold player securely design problem,0,negative
2223,sd500 possession little 3 month lcd broken twice,0,negative
2224,overall excellent phone,1,positive
2225,seems working fine used much,1,positive
2226,also retail store little guy easily plug aux slot store sound system,1,positive
2227,also hold lot diaper,1,positive
2228,regarding pc software support nokia suite work version xp tried connect phone via infrared port laptop,0,negative
2229,surprised find could dvd player play mpeg2 format allowed stack 2 movie dvd also able play vb file created smart ripper,1,positive
2230,bring album absolutely hate track zen allow delete playing order,1,positive
2231,dvd rented would play,0,negative
2232,installed however function work ok disk doctor one button checkup win doctor,1,positive
2233,lengthy extensive journey feature loaded high performance travel size camera initially gravitated little gem superior picture quality 4 mega pixel,1,positive
2234,10 day sound worked video quit working,0,negative
2235,way le expensive ipod,1,positive
2236,anyway thing really look fact phone voice dialing,1,positive
2237,use store brand tall kitchen trash bag already use kitchen special diaper trash bag necessary,1,positive
2238,tiny postage stamp sized remote unit wonderful trigger shutter also used zoom review picture,1,positive
2239,call customer support got live person within couple minute helped tweak couple setting streamline performance,1,positive
2240,zen play mp3 wma wave format make versatile ipod,1,positive
2241,setup software everything,1,positive
2242,able take great photo 4th july fire work got amazing shot kid playing sparkler,1,positive
2243,2 take around 10 000 640x480 picture,1,positive
2244,discovered problem tried contact apex flor 3 month never got touch customer support telephone number always busy answer web customer support,0,negative
2245,3 bag easy change,1,positive
2246,headphone jack gave couple week use stock earbuds replaced day high end sony,0,negative
2247,headphone earbuds average use regular pair instead,1,positive
2248,get great theme wallpaper phone many many polyphonic ring,1,positive
2249,much problem everyone else listed mainly slow processor get damn thing computer completely,0,negative
2250,yet find limitation hitachi hitachi tool way quite frankly know muscle push machine harder,1,positive
2251,tried set router linksys browser interface instruction available tell use installation cd little luck manage connect briefly connection kept dropping idea resolve issue gave,0,negative
2252,disappointed would recommend product,0,negative
2253,huge storage space loaded entire collection music isnt much 400 song still 26 gb 28 provided,1,positive
2254,using bag much cheaper convenient,1,positive
2255,wise investment pocketbook nose,1,positive
2256,anyhow demerit phone phone slow processor ear volume lower 6610 6610 best ear volume among nokia variant,0,negative
2257,included earpiece comfortable easy use,1,positive
2258,said work perfectly,1,positive
2259,smooth plunging mechanism,1,positive
2260,also smaller get look,1,positive
2261,great design sleek touch wheel still never successfully copied virtual one competition wheel click taking away lot headache 3rd gen navigable menu,1,positive
2262,awesome camera huge print quality tiny package,1,positive
2263,sure whether related charge cycle li ion battery better firmware combination factor,1,positive
2264,secondly addition lag time give command easily use able go,0,negative
2265,called apex support number numerous time kept ringing,0,negative
2266,good router cash speed booster one,1,positive
2267,however 600 800 budget think camera excellent choice,1,positive
2268,owned camera short time would n give anything,1,positive
2269,1 speaker home rarely use earbuds though much better one normally get mp3 player,1,positive
2270,need update firewall antivirus separately install two disk,1,positive
2271,zen outstanding way shuttle music source ipod except cumbersome work around using ipod hard drive instead player,1,positive
2272,love,1,positive
2273,found put dirty diaper top loader tendency get streak would get plunger would get cleaned time used,0,negative
2274,height adjustment knob bit flimsy work well provides good accuracy,1,positive
2275,focusing exclusively quality rather excessive marketing introduced player look ipod straight eye flinch,1,positive
2276,headphone came mediocre best expect set ear bud,0,negative
2277,getting router setup vanilla configuration work 99 user easy able problem,1,positive
2278,camera great,1,positive
2279,really cool,1,positive
2280,compatible audible com book,0,negative
2281,send camera nikon servicing took whole 6 week diagnose problem,0,negative
2282,remote stand end harder lose far better designed 1100s,1,positive
2283,particularly like way aid taking macro shot,1,positive
2284,small size perfect little hand may perhaps uncomfortable awkward bigger person,1,positive
2285,fact model would play jpeg slide show big plus visual artist discovered accident mentioned anywhere literature play mpeg1 file regular cd r data disk without vcd formatting,1,positive
2286,thing found havent liked lcd hard read daylight everyone else,0,negative
2287,despite critical start phone deserves four star accomplishes set pretty lofty well dependable,1,positive
2288,biggest plus buy expensive refill,1,positive
2289,mine installed problem uninstall norton anti virus 2002 personal firewall 2002 first,1,positive
2290,construction player cheesiest ever seen front panel refused clip correctly leaving noticeable gap panel base player,0,negative
2291,output component connection look good non hd tv,1,positive
2292,highest optical zoom picture perfect,1,positive
2293,enjoy,1,positive
2294,song transfer lightning fast two battery came box give 24 hour listen time,1,positive
2295,player worth price recommend n purchase,0,negative
2296,impossible change speed finger,0,negative
2297,week n regret purchase one bit never leave home without,1,positive
2298,phone use midi audio file ringtone,1,positive
2299,product far best broadband router market bought replace one linksys instant wireless b router worked great year,1,positive
2300,unit working fine 1st month half color signal disappeared,0,negative
2301,itunes love hate relationship program usually people mac like program people pc depending computer expertise could difficult program use required ipod,1,positive
2302,cool feature great camera zoom cool quality picture great ringtones bluetooth feature great,1,positive
2303,sound decent would estimate get maybe 80 quality would true line jack,0,negative
2304,yet used feature like calendar etc music player little thing rock,1,positive
2305,bag attach inside champ easily one cram diaper flip handle,1,positive
2306,dvd play basically junk,0,negative
2307,sometimes various application crash,0,negative
2308,player overall disappointment couple big flaw potential buyer wary reader need know third party software company resolve virtually creative mediasource file transfer issue,0,negative
2309,take pic friend picture pop call,1,positive
2310,catch built like piece crap,0,negative
2311,really enjoyed camera phone,1,positive
2312,switch soft start depth lock within easy reach right hand,1,positive
2313,speaking battery removable replaceable,1,positive
2314,use scented bag even smell,1,positive
2315,night mode clear day,1,positive
2316,could get one camera,0,negative
2317,use modem computer connect client friend possibility endless,1,positive
2318,thought given 10 review camera would buy spite bit pricey,0,negative
2319,got way many blurry picture,0,negative
2320,first used router free hand mode liked lot,1,positive
2321,take camera u everywhere constantly amazed quality picture get number different way camera allows picture taken,1,positive
2322,overall tool well worth price regret purchase,1,positive
2323,steel backing pick fingerprint scratch easily great cosmetic standpoint,0,negative
2324,creative medium source easy use get hang file transfer fast,1,positive
2325,matter format,1,positive
2326,adjust volume heard anywhere n make big disturbance,1,positive
2327,work even turn lcd viewing great battery saver,1,positive
2328,said way back amazon one song include provided far better sound ipod,1,positive
2329,battery replaceable real plus leather case another real plus,1,positive
2330,using linux want use gprs connect net suggest phone along belkin usb bluetooth adapter,1,positive
2331,earbuds come n bad,1,positive
2332,upgrading driver firmware time e mailing tech support setting tip work fine,1,positive
2333,one still work fine quit one day,0,negative
2334,linksys quality tech support outstanding,1,positive
2335,us extend able mmc memory perfect storing video picture mp3s,1,positive
2336,4 zen store data file allow folder structure allow document opened program launched disk must copied another hard drive launched,0,negative
2337,perfect phone small appealing package,1,positive
2338,handsfree provided phone useful talk phone driving,1,positive
2339,fact 0 key space key text input bit confusing many phone use key instead,0,negative
2340,battery last long playing music writing file player drain battery fast need plugged outlet sending file,1,positive
2341,suprisingly easy use,1,positive
2342,fact people present changed almost 3 month old son diaper amazed potent smell dirty diaper seems disappear dispose diaper diaper champ,1,positive
2343,used 1 4 collet 1 2 round bit love start little torque run quietly,1,positive
2344,ni 2003 worked like charm last year,1,positive
2345,even shorter battery life though impaired positive experience zen micro way,0,negative
2346,ringer loud heard ringing inside office already street,1,positive
2347,short nokia know phone work palm heed advice spend hour technician around globe reading script chiding broken english following direction exactly,0,negative
2348,basically 6600 bundle hyped feature need get pda pocket pc none work basic phone function ergonomics le average,0,negative
2349,menu option uncreative see full screen menu item pick scroll find looking yes minor trying keep eye road,0,negative
2350,mp3 player everything need long last good three year satisfied,1,positive
2351,customer service dept list toll free number real hassle get regular line,0,negative
2352,strictly use lcd view finder highly recommend camera,1,positive
2353,also quite partial creative mediasource organizer player software audigy z sound card originally definitely added plus,1,positive
2354,sit back relax brag friend paid mountain money dvd player half thing one fraction price,1,positive
2355,lot people complain creative software actually find creative mediasource organizer strength itunes,1,positive
2356,auto mode anyone use point shoot camera,1,positive
2357,feature one would need cellphone,1,positive
2358,would like give 3 5 star instead 4 gave 4 run well time owned,1,positive
2359,money apex machine good feature,1,positive
2360,reliable,0,negative
2361,much packed small case affordable,1,positive
2362,annoying,0,negative
2363,problem battery life,0,negative
2364,ever glad decided camera,1,positive
2365,decided go diaper champ rather popular diaper genie like idea buy special bag,1,positive
2366,probably person dislike itunes software,0,negative
2367,easy use sheer fun able use array nikon accessory like telephoto wide angle lens proverbial icing cake,1,positive
2368,anyway player great deal really love,1,positive
2369,otherwise great alternative mp3 player use want worship mighty powerful apple,1,positive
2370,buy product,0,negative
2371,pic touched photoshop printed 4x6 look great,1,positive
2372,conduct rigorous test took identical shot identical lighting camera canon hand,1,positive
2373,looking user friendly diaper pail actually keep odor contained diaper champ one,1,positive
2374,since gotten linksys modem befcmu10 stacked wrt54g router work fantastic,1,positive
2375,device look cool think exactly photo promise comfortable lightweight jacket pocket interface control easy enough navigate bit practice,1,positive
2376,disappoints software like cheap get zero support form symantec want support charge fee,0,negative
2377,heavier sturdy casing,0,negative
2378,software installed window 95 98 2000 xp problem,1,positive
2379,look cool seems quite small light,1,positive
2380,using motorola t720i verizon alot dropped call trouble syncing data,0,negative
2381,way go apple,1,positive
2382,got home discovered menu option sending message via either text email simply n,0,negative
2383,camera also great feel weight,1,positive
2384,great phone buy another,1,positive
2385,zen serf back device well player,1,positive
2386,bought camera reason many considering already bought size,1,positive
2387,product rate five star,1,positive
2388,zennx keep running price replacement battery like battery powered appliance,1,positive
2389,zen offered great alternative,1,positive
2390,neither message answered ask 24 hour replying waiting 27 day,0,negative
2391,use primarily provided protective case although dropped 3 foot desk accident well played outdoors 30 fahrenheit weather design continued work fine,1,positive
2392,fm transmitter belkin good one use zen car stereo fm tuner latest find connected baby 3800 audiophile audio system produced clean sound compared ipod,1,positive
2393,macro mode exceptional picture clear take picture lens unbelievably close subject,1,positive
2394,guide fence freehand routing well made solid,1,positive
2395,feature user interface find little inconvenient,0,negative
2396,rate interested digital photography price confusion held back consider canon s100 digital elph,1,positive
2397,however configuration system actual setup router wireless use took 3 hour briefly made reconsider choice ego airport notoriously easy setup,0,negative
2398,6 play game boy color game go boy,1,positive
2399,find pretty easy use unlike remote interface audigy 2 nx pc,1,positive
2400,got buddy trying offload almost new 300 systematic saw router,1,positive
2401,excellent sound found music reproduced faithfully jukebox,1,positive
2402,easy enough remove front plate one way battery could inserted,1,positive
2403,unlike reviewer found support responsive almost wait time phone relatively knowledgeable,1,positive
2404,least sturdier protective carrying case would nice,0,negative
2405,obvious setup instruction though soft copy manual give answer readily,0,negative
2406,quick setup installation fact disc come pretty much make sure cant mess,1,positive
2407,diaper get stuck turned around tightly wrap first,0,negative
2408,tried morning said required permission lacked proper administrator status,0,negative
2409,night trying make stupid thing work avail,0,negative
2410,way shove finger pull tight,0,negative
2411,work great odor us regular bag,1,positive
2412,strap horrible get way part camera need access,0,negative
2413,original review december 2004 sorry read people problem zen micro mine worked great,1,positive
2414,opening champ empty bag little tricky pinched thumb time got hang,0,negative
2415,must add dismay delight reader phone simply groundbreaking phone mankind ever held,1,positive
2416,one primary reason getting cell phone could use internet connection laptop running linux soft modem driver hard find work well,1,positive
2417,tell many time chipped nail hurt fingertip force needed open,0,negative
2418,phone book user friendly speakerphone excellent,1,positive
2419,little bag come cheap useless,0,negative
2420,regardless fact believe champ best way go,1,positive
2421,great phone phone since feb 04 never problem,1,positive
2422,one best cell phone ever used date,1,positive
2423,yeah agree earbuds pretty crap replace,0,negative
2424,much safer others require two handed operation,1,positive
2425,complaint mp3 player,1,positive
2426,tried hook first one broken motor would eject disc close door,0,negative
2427,however creative software real intuitive,0,negative
2428,speaker volume loud clear sacrifice battery life,0,negative
2429,taken hundred shot canon varying lighting situation auto mode one blurry picture,1,positive
2430,2 unfilled id3 tag cause music potentially placed folder called unknown,0,negative
2431,love slim design weight would issue bulky,1,positive
2432,well apex dvd player turned great,1,positive
2433,unit worked great 3 week video output failed,0,negative
2434,3 joy stick eazy navigation 35mb memory card store picture stuff,1,positive
2435,five gigabyte plenty great album,1,positive
2436,talking voice clear,0,negative
2437,apple ipod battery replacement service cost 100,0,negative
2438,unit lock time hit reset button fairly painless process well,0,negative
2439,mp3 player get much memory much le ipod,1,positive
2440,important people know following first interface slow,0,negative
2441,getting better speed web program,1,positive
2442,easy work easy dispose dirty diaper,1,positive
2443,location various button one side somewhat illogical,0,negative
2444,volume key hard press think may design rather flaw perhaps keep pressing accidentally call,0,negative
2445,thought kind steeply priced time,0,negative
2446,purchased ipod mini several nice feature extra 1g storage wma support replaceable battery especially apple product proprietary architecture,1,positive
2447,nice thing m12v table powerful 3 1 4 hp motor great soft start help lot control beast turn router continuously variable speed control amazon price,1,positive
2448,software interface supplied easy use went ahead got red chair notmad software advanced feature wanted,1,positive
2449,overall g3 delivers must considered best image quality current 4 megapixel digicams detail tonal balance color response point view,1,positive
2450,take quick picture excelent resolution,1,positive
2451,memory card fit nicely since also pocket pc automatically installed picture software pda willa,1,positive
2452,computer interface 90 good losing point due fact creative branding place within,1,positive
2453,knock flash underpowered,0,negative
2454,connect computer via bluetooth transfer image calender event contact anything else,1,positive
2455,wonderful device,1,positive
2456,sound quality jazz pop music equally superior,1,positive
2457,color phone combination feature 6610 offer,1,positive
2458,product elf great,1,positive
2459,oval nice,1,positive
2460,work great,1,positive
2461,locked multiple time previously always managed work ward time touch screen respond none button worked,0,negative
2462,highly recommend phone anyone,1,positive
