train_idx,text,label,label_text
1414,creative definitely come winner term product design feature look forward nomad zen line product seizing market share people begin realize quality better determinant experience quantity hype,1,positive
1415,feel much le likely drop phone others actually starting get small,1,positive
1416,technology wise think awesome plus speaker make even great love phone,1,positive
1417,mentioned review headphone useless need replaced right away,0,negative
1418,would highly recommend want learn something interested learning stuff want working wireless router get wrt54g,1,positive
1419,purchase separately outrageous cost,0,negative
1420,occasion able connect phone isync via bluetooth found rebooting phone seems solve problem,0,negative
1421,overall small sound great le expensive apple overpriced ipod,1,positive
1422,significant complaint sound quality,0,negative
1423,comment overall still great value kind overrated sense beater deal market,1,positive
1424,could probably use trash ok point pr duct seems work well far,1,positive
1425,soft start tremendous help type operation,1,positive
1426,apparently mobile heavily back logged keep demand,0,negative
1427,sure,1,positive
1428,love touchpaper control,1,positive
1429,installation simple downloaded updated software creative website downloaded music,1,positive
1430,interface practically seamless,1,positive
1431,service mobile good,1,positive
1432,accessory make ipod digital recorder broadcast remotely stereo speaker using wireless technology play car speaker using either cd adaptor fm stereo broadcaster,1,positive
1433,auto focus performs well love 12 optional scene mode dummy proof correspond many situation would actually seek use camera,1,positive
1434,ring tone come crazy song annoying ring one ring sound close regular ring,0,negative
1435,2 nice feature like web browser camera video recorder speaker phone usefully clear voice reception,1,positive
1436,best class,1,positive
1437,gave got diaper decor,0,negative
1438,strange noise obvious defect would accepted replacement clearly defective inferior operating system one intend waiting patch,0,negative
1439,simple click button back button volume display easy read access use,1,positive
1440,two main requirement longer battery life lower price found,1,positive
1441,great camera using several month got excellent result simple friendly usage many scene indoor outdoor snow close macro etc,1,positive
1442,man work put chinese song player actual chinese name song title,0,negative
1443,nokia year one packed whiz bang feature disappointing primary use phone,0,negative
1444,3 joystick design using new nokias give great degree control,1,positive
1445,camera 2 year take pretty good picture,1,positive
1446,impressed purchase sd500 bought beginning month ultimate pocket camera shot 300 image far,1,positive
1447,camera re ponce quick,1,positive
1448,simply canon g3 best digital camera today price point,1,positive
1449,startup time quality picture video outstanding,1,positive
1450,uninstalled systemworks internet security least fifth time due functionality issue,0,negative
1451,fact liked much using son 2 year old bought one new baby room,1,positive
1452,4 look great,1,positive
1453,button necessary lil gadget side player nice holding palm hand,1,positive
1454,key close together layout bit funky relation standard rectangular layout keypad weird,0,negative
1455,however symantec taken significant turn worse release,0,negative
1456,mobile trying hard pretty good csr,1,positive
1457,sleeker smaller average mp3 player nitrus great ipod blow water interface great design wonderful,1,positive
1458,product amazing better ipod get price,1,positive
1459,plus changeable battery load presets environment decent construction still quite small light despite slightly bigger ipod,1,positive
1460,complaint reason gave 4 star instead 5 camera control intuitive,0,negative
1461,barely hold anything mine put bunch thread fuzz player bag cheap seems coming apart,0,negative
1462,like shape keypad joystick,1,positive
1463,plus order amazon com exchange problem,1,positive
1464,let turn av protection back stop alert,0,negative
1465,reception sound quality top notch,1,positive
1466,2600 false silver plate instead play display,0,negative
1467,thing n like cover suck,0,negative
1468,extra gb bonus,1,positive
1469,also removed spring plunge tube make easier raise,0,negative
1470,software easy use although red hat software better cost money,1,positive
1471,else camera still vga,0,negative
1472,clarity unbelievable mean cram almost full 2 5,1,positive
1473,disable individual component fooled still running,0,negative
1474,word satellite issue either user guide knowledge database linksys com first tech support person spoke kept phone hour gave web site address consult turned one already found search,0,negative
1475,picture video quality ok,1,positive
1476,portable player feel bit durable,0,negative
1477,opening could little wider suppose really seen anything else could improved,0,negative
1478,give bang buck period,1,positive
1479,stay away product,0,negative
1480,product way cooler anything ive used pencilings maccabees norton antivirus alone,1,positive
1481,color screen good,1,positive
1482,enterprise piece hardware find office corporate environment,0,negative
1483,software could n better mp3 player work like dream could n give anything 5 wish 6,1,positive
1484,pi ii 1ghz 512mb rd ram window xp pro 80gb hd able uninstall ni 2003 install ni 2004 trouble,1,positive
1485,shorter sleeker compact fit comfortably small hand ipod nokia cell phone tower bad boy,1,positive
1486,apex website wo n answer phone,0,negative
1487,mobile upfront term qualify rebate,0,negative
1488,first digital camera toy,1,positive
1489,must gotten good one,1,positive
1490,first battery,0,negative
1491,added crank time need make fine adjustment seldom use,0,negative
1492,reading review lcd problem cracked black blob etc figured probably limited problem,0,negative
1493,interface work great,1,positive
1494,first 4 month bedroom even smell odor,1,positive
1495,tried many time get hold apex n seem answer email telephone number constantly busy believe one lonely customer service rep probably extremely overworked,0,negative
1496,take lot picture camera first choice,1,positive
1497,n abuse charged every day headphone jack sort fizzled,0,negative
1498,nikon coolpix 4300 wonderful easy use high quality compact size,1,positive
1499,90 day show picture matter,0,negative
1500,first serious serious installation problem,0,negative
1501,play original dvd cd play mp3s jpegs,1,positive
1502,u like tinker think creative offer advantage,1,positive
1503,unlike 3 mp3 player thing work properly id3 tag track,0,negative
1504,battery life phone surreal,1,positive
1505,ipod overpriced compared market,1,positive
1506,happy solid state device died short period time quick review product space yield brand seem much better linksys,1,positive
1507,battery life amazing,1,positive
1508,really perfect travel camera plus offer convenience digital photography,1,positive
1509,left camera car maine hot place lcd screen cracked,0,negative
1510,ipod package come everything need ac adaptor firewire cable quicker usb slower usb 2 also give snazzy power full headphone course player,1,positive
1511,pro excellent sound even headphone come box absolutely rocked bose quiet comfort 2 set,1,positive
1512,running great dvd rented,1,positive
1513,new canon s300 33 larger 26 heavier s100,1,positive
1514,sound quality excellent speaker phone easier use,1,positive
1515,forgot case n fit,0,negative
1516,namely wouldnt sync,0,negative
1517,great camera point notice review may concern especially advanced amatuer,1,positive
1518,seems program scan feature find exe file outlook,0,negative
1519,f doesnt look pretty spending kind cash want something aesthetic bit course,0,negative
1520,legitimate criticism online review fact lens really obstruct viewfinder,0,negative
1521,plus fact used regular trash bag great,1,positive
1522,camera marvel,1,positive
1523,low profile space saving design look nice,1,positive
1524,audio mono fairly acceptable quiet also little distortion,1,positive
1525,bought little guy week back say never much fun new toy,1,positive
1526,personally may never buy symantect product,0,negative
1527,benefit many reason one appearance pant wo n bulging phone pocket,1,positive
1528,apex 2600 steady performer,1,positive
1529,impressed easy camera use,1,positive
1530,1 picture taken indoor setting little dull rarely hazy tend take photograph distance,0,negative
1531,stored around 60 cd 160kbps barely touched available memory,1,positive
1532,opposed nomad ii flash based player song load extremely fast one two second per song,1,positive
1533,really shame otherwise creative mp3 player good best sound quality player market,1,positive
1534,otherwise player awesome,1,positive
1535,well nice lasted,1,positive
1536,although sd500 take great quality photo sensitivity lcd compromise quality overall,0,negative
1537,software quick easy use found entire process easily mastered,1,positive
1538,looking small compact super resolution digital camera end search nikon 4300,1,positive
1539,verdict needed something tad bit space consider player fair game,0,negative
1540,compared leading dd mp3 player value per gb top,1,positive
1541,even battery life great advertises 14 hour actually little le still good,1,positive
1542,program brings problem virus albeit major problem expect 70 buck,0,negative
1543,canon get picture appear photo still camcorder shot,1,positive
1544,easy learn use intuitive enough even novice,1,positive
1545,screen review could better,0,negative
1546,zen micro mine black lot going,1,positive
1547,first say never slightest problem camera software,1,positive
1548,price,0,negative
1549,time without hitch,1,positive
1550,fantastic camera well worth price,1,positive
1551,2 ergonomically find even point shoot lens,0,negative
1552,click picture jog format phone bluetooth device find extremely easy transfer pic pc forth,1,positive
1553,also work fine international call,1,positive
1554,taking picture people however show every flaw subject skin,0,negative
1555,love pail,1,positive
1556,big lcd screen least 2 enough,1,positive
1557,3 play java game,1,positive
1558,new market looking buy symantec software product save money buy 2003 version,0,negative
1559,instruction come n explain make thing simple,0,negative
1560,overall great unit hopefully creative lab vendor soon come accessory,1,positive
1561,manual functionality excellent downloading picture quick breeze quality astounding,1,positive
1562,gon na go feature cause reading review probably already looked must say dj feature cool removable battery also bonus,1,positive
1563,respectable solid awe inspiring,0,negative
1564,wood pushed thru fast slow little bog,1,positive
1565,key tightly packed finger likely press two key,0,negative
1566,still alive still kicking still playing,1,positive
1567,software easy use transfer super fast,1,positive
1568,capacity problem,1,positive
1569,3 joy stick eazy navigation 35mb memory card store picture stuff,1,positive
1570,good symantec soft ware bit hard master savvy computer,1,positive
1571,phone fantastic,1,positive
1572,noiseless lightweight oh yeah,1,positive
1573,bit heavy hand held work router size,0,negative
1574,phone cool useful feature speakerphone,1,positive
1575,outstanding signal reception,1,positive
1576,like size shape,1,positive
1577,excellent router price,1,positive
1578,rarely get drawn mass commercialism something ipod made say word lou andy want one willing shell,1,positive
1579,another plus book file limit,1,positive
1580,diaper champ great,1,positive
1581,problem using musicmatch software already computer load song album onto unit,1,positive
1582,case doesnt close maybe mine faulty case isnt great,0,negative
1583,love camera,1,positive
1584,tried free version zone alarm free version skate nice easy installation work great,1,positive
1585,battery last longer,1,positive
1586,light phone little le 3 oz long battery life long new polymer technology,1,positive
1587,review sound quality generally universally positive,1,positive
1588,overall highly recommend phone,1,positive
1589,ipod great buy,1,positive
1590,1 feature amatuer photo enthusiast would want,1,positive
1591,owned two week expect looking getting another progressive scan dvd player higher quality soon,0,negative
1592,however setting using quick start instruction breeze,1,positive
1593,opinion best camera money looking something easy use small good travel provides excellent sharp image,1,positive
1594,perfect size small large also feature high tech phone user would want,1,positive
1595,wrt54g offer excellent security feature much easier configuration menu even need manual setup correctly,1,positive
1596,finally decided purchase player compatible napster 2 go subscription service allowing download much music want 14 95 flat fee,1,positive
1597,dependability seen glitch,1,positive
1598,installed activated registered ni 2004 without issue,1,positive
1599,symantec give u refund apology,0,negative
1600,purpose clarity review product edited appropriate product since part share many problem,0,negative
1601,3 picture come hazy hand shake even moment entire process taking picture,0,negative
1602,picture quality camera outstanding taking size price consideration,1,positive
1603,tried calling 866 4apexgo get,0,negative
1604,ease use ipod major attribute,1,positive
1605,unlike reviewer like tool easy operate outside router table,1,positive
1606,casio unit given great service would happy get another one tempted ipod sleek design storage capacity connection option firewire usb integration itunes,1,positive
1607,photo quality amazing know going fun feature,1,positive
1608,nokia mobile really teamed well baby,1,positive
1609,actually using nomad jukebox easy uncomplicated,1,positive
1610,everything listed zen,1,positive
1611,exposure compensation 1 3 stop increment leave set 1 3 stop brighten default exposure go bit dark taste,1,positive
1612,site offer live help,0,negative
1613,additionally fun stuff like tone wallpaper screen saver stop clock alarm java application chess currency converter etc,1,positive
1614,storage capacity great,1,positive
1615,glad work norton,0,negative
1616,game kind stink cant download get link cable get additional game,0,negative
1617,remote okay fan remote tiny button,0,negative
1618,also unproven battery life,0,negative
1619,phone nice blend feature without going overboard,1,positive
1620,double speed 2x forward speed still play mp3s sound pitch corrected smooth twice fast,1,positive
1621,overall build quality good macro result impressive video quality good picture flash good colour sharp result excellent auto white balance,1,positive
1622,sound quality ipod sound quality pretty good,1,positive
1623,function lever one switch capture view mode feel fragile,0,negative
1624,lot problem setting since software given along buggy,0,negative
1625,mentioned creative mediasource software actually really robust despite others said though notmad may still work better,1,positive
1626,using software itunes relatively simple plug usb cable wait machine detect ipod voila song listed itunes library transfer ed ipod,1,positive
1627,compatibility device excellent found one 11b device work mixed mode work anyone mixed mode,1,positive
1628,opened box shocked size thing tiny,1,positive
1629,needed three battery keep going s330 battery g3 real powerhouse,1,positive
1630,player fast sound great also many option like slowing speeding music making sound like hearing music huge auditorium,1,positive
1631,headphone jack thing garbage,0,negative
1632,57 picture total lcd went black except icon showing setting,0,negative
1633,smell easy use one hand free best us regular tall kitchen garbage bag get suckered using bag made pail impossible find,1,positive
1634,connect player computer via usb open mediasource listen stored mp3s stream directly xtra,1,positive
1635,small,1,positive
1636,day listening song locked anything,0,negative
1637,2 thing need fixing first battery life run 6 hr without problem medium usage button,0,negative
1638,several different occasion displayed disc disc inside,0,negative
1639,overall router seems like reasonably priced product th,1,positive
1640,pleased product,1,positive
1641,listed feature one thing sold unit play mpeg video,1,positive
1642,think biggest flaw,0,negative
1643,give 4 star installation process rather problem may surface installation process frustrating average computer user,0,negative
1644,m scandisk would appear due manual shutdown would scan 2nd bar 1 hr shut used go back,0,negative
1645,click wheel incredibly convenient however little overly touchy time make frustrated finger,1,positive
1646,1 champ easy use,1,positive
1647,believe camera still available find one might like get,1,positive
1648,get one accessory cheap extended warranty player get highly recommended,1,positive
1649,gripe hardware button,0,negative
1650,tried pail none compared positively champ,1,positive
1651,without doubt finest looking apex dvd player seen,1,positive
1652,player smaller think,1,positive
1653,transferring song player interface crashed time 4 5 time 4 5 hour period normally would cause major concern appears bug reproducible lead believe creative fix patched version shortly maybe computer,0,negative
1654,however failed deliver quality,0,negative
1655,,1,positive
1656,intuitive would like,0,negative
1657,good 1 large lcd screen colorful display good resolution,1,positive
1658,friend told diaper genie work well bought diaper champ based line review happy,1,positive
1659,pleased router,1,positive
1660,2 phone awfully slow,0,negative
1661,however playing three week convinced zen micro superior,1,positive
1662,sound bright clear ability store mp3 apple approved file great plan make use storage space sound recording time time,1,positive
1663,used corporate edition work without problem ever,1,positive
1664,problem touch pad sensitivity set low interface breeze use without even looking pdf manual,1,positive
1665,compact attractive machine easy set,1,positive
1666,usb 2 0 transfer insanely fast,1,positive
1667,beautiful design lot feature easy use configurable customizable battery duration amazing,1,positive
1668,nothing good luck mobile,1,positive
1669,issue right bat freezing staying shutting mode functioning well general,0,negative
1670,killer problem well done either,0,negative
1671,e interface took little getting used almost second nature,0,negative
1672,froze bad even use power button turn open take battery,0,negative
1673,usb 2 0 fast,1,positive
1674,part good dvd player,1,positive
1675,enjoy getting use touch pad,1,positive
1676,sound excellent battery life excellent fact battery replacable excellent finally price 200 cheaper 40gb ipod excellent,1,positive
1677,camera adequate want high re photo use digital camera instead,1,positive
1678,right firmware drag drop player like jump drive,1,positive
1679,must differing preference others prefer supplied earbuds sony thought sounded good player,1,positive
1680,product suck customer service apex suck,0,negative
1681,whichever may happy made purchase,1,positive
1682,movie played yesterday wo n play today,0,negative
1683,machine seems fine software came awful,0,negative
1684,beat carrying 500 cd collection wherever go,1,positive
1685,first glance thought phone little big maybe little complicated,0,negative
1686,follow instruction carefully based cd everything need get running time,1,positive
1687,compact size highest priority 2 megapixel camera canon powershot s100 digital elph standout choice aptly named diminutive design,1,positive
1688,also say take long moment camera digital image processing time press button camera actually take picture,0,negative
1689,make innumerable short coming biggest inability download update due problem liveupdate,0,negative
1690,rate one star work pretty good,0,negative
1691,also much le stinky,0,negative
1692,contrary ive read elsewhere g3 sync 1 250 second third party flash dedicated flash canon,1,positive
1693,color screen crisp liked,0,negative
1694,disappointment far battery life,0,negative
1695,still love,1,positive
1696,sure bad review computer especially slowed win 98,1,positive
1697,bored silver look,0,negative
1698,simply best player market really low price look anywhere else,1,positive
1699,beef raise regard pop face sometimes come bit easily besides perfect,0,negative
1700,battery life seems good take little time charge uploads mp3s quickly delay song,1,positive
1701,purchased jukebox got fried recharged asked 20usd look said would charge reaping damned thing,0,negative
1702,took try get use navigation user friendly player imo,1,positive
1703,fit finish product first rate,1,positive
1704,awesome newbie though personally like fasten every bolt,1,positive
1705,whole bunch device sounding name long,0,negative
1706,upon opening box confronted small cute little mp3 player,1,positive
1707,thing le month treated quite well never dropped headphone jack screwed,0,negative
1708,purchased phone knowing slightly old compared newer model nokia phone available,0,negative
1709,new driver cannon site help try want made use backup software,0,negative
1710,also slow song speed cool,1,positive
1711,keep one hand baby dump diaper time simple,1,positive
1712,unarguably better apple nice earbuds boot,1,positive
1713,embarassing getting phone call family member telling dvd player gave le 3 month ago longer working,0,negative
1714,high 2004 edition mostly low,0,negative
1715,way talk customer care,0,negative
1716,solid squeak free large screen,1,positive
1717,warning window remove program feature good job neither norton removal program,0,negative
1718,sleek design large memory capacity compatibility itunes ease use make one best portable digital listening device market,1,positive
1719,could make phone call location previously could like apartment,1,positive
1720,excellent phone phone look much better u see picture,1,positive
1721,look sleek modern,1,positive
1722,1 included lens cap loose camera,0,negative
1723,far seems best value money undecided creative zen micro seems best choice,1,positive
1724,different thing choose kind playing interface see interface modern classical,1,positive
1725,price incredible bonus pack hitachi 25 incentive need code go tool seeker com tell,1,positive
1726,unfortunately touch pad issue non intuitive poor instruction guide killed,0,negative
1727,cheaper hold song smaller,1,positive
1728,necessary scan m money database close program,0,negative
1729,recommend mobile nokia 6600 without reservation,1,positive
1730,stored 40 audio cd still close 2 8 gb free,1,positive
1731,see review place cracked lcd screen,0,negative
1732,hold odor nicely,1,positive
1733,firmware bug download install latest firmware linksys,0,negative
1734,buying player use napster go wait,0,negative
1735,phone must shut taken apart change memory card turning phone back take little,0,negative
1736,well backlit keypad,1,positive
1737,mobile pretty good server,1,positive
1738,kinda heavy kinda like walkman,0,negative
1739,best electronic bought since born,1,positive
1740,longer battery life greater accessibility online music service pc compatibility sensibility,1,positive
1741,navigation bit tricky take getting used included pdf instruction cover operation pretty well,0,negative
1742,camera take amazing picture size beat,1,positive
1743,2 easy enough grandmother use,1,positive
1744,phone winner,1,positive
1745,fine adjustment knob came router difficult use router table,0,negative
1746,headphone n best really expect much small headphone insert ear cavity,0,negative
1747,simple use,1,positive
1748,ok score 7 0 oh yes newest color phone quite cool,1,positive
1749,even leaving default setting without eax enhancement produce crystal clear playback,1,positive
1750,overall happy toy,1,positive
1751,overall pleased,1,positive
1752,since replaced pair black sennheisers packaged earbuds pretty uncomfortable similar ipod target ipod thief nyc,0,negative
1753,one really great,1,positive
1754,good enough,0,negative
1755,sunset feature take incredible pic morning evening,1,positive
1756,yes picture quality feature numerous mention unmatched camera price range,1,positive
1757,customer service agent always prompt polite service terrific,1,positive
1758,recommend phone anyone anytime,1,positive
1759,initially impressed loading 180 song seemed function well would lock battery removal remedied downloaded upgrade everything seemed alright,1,positive
1760,include mp3 wave wma wma pro wma loss le user friendly simply right clicking file converted,1,positive
1761,3x optical zoom average camera,0,negative
1762,eax feature pretty cool well creative included number eq adjustment example compensate extraneous noise encountered car train,1,positive
1763,love camera,1,positive
1764,like predecessor quickly revised nx player boast decent size weight relatively intuitive navigational system categorizes based id3 tag excellent sound widely known better ipod surprising considering number year creative audio peripheral business,1,positive
1765,resolution good color bright even changeable,1,positive
1766,looking phone integrate easily sonyericsson phone isync say stick sonyericsson,1,positive
1767,software mediasource work pc laptop intel p4 2 0 xp o,0,negative
1768,camera great wonderfully small attractive hi tech casing,1,positive
1769,downloaded updated firmware followed easy setup instruction,1,positive
1770,sony ericsson t610 t610 far inferior,1,positive
1771,file log responding program blocking cooky unauthorized site,0,negative
1772,navigating menu super easy especially owned previous model nokia phone,1,positive
1773,g3 loaded many useful feature unlike many smaller digital camera easy hold steady using slower shutter speed,1,positive
