train_idx,text,label,label_text
0,really recommend anyone need new player,1,positive
1,good every day camera fit nicely pocket jean take quality photo,1,positive
2,dollar dollar dvd player probably best,1,positive
3,got phone yesterday find problem yet,1,positive
4,1 price gb storage,1,positive
5,one cabinet shop using one regularly router table 11 year without problem,1,positive
6,say o phone run issue,0,negative
7,model appears especially good,1,positive
8,find stable hand weight actually contributes stability,1,positive
9,catch play movie fine refused read second disc movie extra two occasion tried,0,negative
10,con fm radio tuner something large number compete tor,0,negative
11,move focus range almost anywhere scene push button screen manual focus mode would really helpful shooting scene tough automatically focus,1,positive
12,problem night day screen easy see,0,negative
13,first diaper genie costly refill also stinky,0,negative
14,tech support worthless,0,negative
15,navigation take much time would eventually drive crazy,0,negative
16,n firewire real complaint since window user n generally firewire card,0,negative
17,love rounded edge fit much better pocket jean suit,1,positive
18,thing everything wash dish,1,positive
19,unfortunately loading 280 song get player either connected busy,0,negative
20,crystal clear,1,positive
21,zen xtra transfer file player folder name,0,negative
22,camera great job exposure print made professional printer look great good print pro digital camera still good,1,positive
23,course good customization option unit well sound presets navigating option playlist etc,1,positive
24,built router table tilt top made hand crank replace height adjustment knob two thing make easy change raise lower bit,0,negative
25,issue enabled wep encryption moved wpa,0,negative
26,hooking thing found would played le 50 dvd put,0,negative
27,would much nicer window could see screen button n cover ac jack,0,negative
28,e mailed online tech support simple question got reply totally unresponsive looked though actually read e mail sent back boilerplate paragraph,0,negative
29,one good looking,1,positive
30,long lasting battery life,1,positive
31,voice recorder beautiful add even necessary example apple want money creative lab want make better player,1,positive
32,however mind 299 lot pay device last 18 month,0,negative
33,problem handle use open top compartment,0,negative
34,mac osx user isync work fairly well,1,positive
35,one ever come house noticed diaper odor,1,positive
36,really made mediocre mp3 player software,0,negative
37,quick spin dial select shutter priority high speed subject aperture priority focal length full program mode camera selects ideal photo quality,1,positive
38,picture fanatic consider picky way camera let buy,1,positive
39,af feature great job converting letterbox fill 3 4 screen image still looked normal,1,positive
40,another point note battery life incredible,1,positive
41,definitely keep smell,1,positive
42,simple use hook,1,positive
43,sound loud enough play back video clip camera,0,negative
44,combine excellent price got gold box really happy,1,positive
45,thank apple make fabulous product,1,positive
46,affordable better player window,1,positive
47,problem using player feel good player,1,positive
48,sleek looking good front panel button layout great feature set,1,positive
49,old siemens s56 hand worked beautifully,0,negative
50,fourth linksys product aside rough start satisfied router,1,positive
51,player minor glitch like example turn 60 percent time si shutting mean turn turn liking,0,negative
52,easy,1,positive
53,extremely well priced getting,1,positive
54,also take kitchen sized trash bag special bag stock,1,positive
55,within one month player completely died,0,negative
56,sound great portability etc stuff expect good mp 3 player zen micro,1,positive
57,zero star rating would give,0,negative
58,speakerphone,1,positive
59,empty every day never odor,1,positive
60,took father house play tom jones concert dvd loved player much gave,1,positive
61,color 10 variety hot color made difficult choose,1,positive
62,drawback encountered 1 indoor shot distance 8ft lack contrast color found problem camera built flash used even nikon slr,0,negative
63,close 12 hour least replaceable included second one free,0,negative
64,diaper champ serf purpose live good review,0,negative
65,set optical zoom shooting shooting video adjust digital zoom however due camera light weight camera shake problem contend,0,negative
66,overall micro solid device fell problem yet knock wood,1,positive
67,easy use small form factor look good boot,1,positive
68,battery life ok somewhat short working lot monitor,1,positive
69,attractive feature small size layout remote,1,positive
70,also easy empty,1,positive
71,although disabled norton antispam still,0,negative
72,must product new mom,1,positive
73,fm radio option listen music anytime,1,positive
74,far work fine either cable wireless connection,1,positive
75,loved broke le month acceptable period time something work,0,negative
76,problem button power button print share button nice click,0,negative
77,already emailed creative tech support gotten timely response fix necessary,1,positive
78,came price player hard beat,1,positive
79,bought one enjoyed date,1,positive
80,8 creative mediasource although sleek looking window medium player effective organizing collection linked good cb service gracenotes,1,positive
81,recent stop responding button,0,negative
82,found best result situation manual center auto focus manual mode iso 100 shorter aperture time often sharper image iso 50 auto white balance auto white balance better canon camera already well,1,positive
83,find bit difficult manage tiny button impossible read icon without reading glass,0,negative
84,sd500 focus flawlessly whine video picture razor sharp,1,positive
85,mobile text messaging chat picture sharing etc nicety would enjoy,1,positive
86,pro large hard drive 20gb 40gb affordable,1,positive
87,small light nice looking display decent well,1,positive
88,great phone easy use excellent network regret,1,positive
89,record memo using built microphone,1,positive
90,nice color screen,1,positive
91,sound quality also nice hooked sony headphone instead factory earbuds come,1,positive
92,scroll bar problem make task creating playlist frustrating,0,negative
93,multiple try one disk finally recognized video poor feature available,0,negative
94,anyway wife got birthday love thing,1,positive
95,phone one milestone history cellular phone,1,positive
96,however disappointed product symantec,0,negative
97,software great long administrative user account window xp,1,positive
98,mindless operate,1,positive
99,one thing default ringtones come phone horrible,0,negative
100,excellent router money,1,positive
101,xtra improves upon zen nx larger blue backlit screen infinitely better,1,positive
102,even better optional headset listen music integrated radio,1,positive
103,incredible memory,1,positive
104,6600 provide similar service developed area state well remote area,0,negative
105,1 ability selectively switch raw format record review give incredible post processing flexibility,1,positive
106,offense amazon able find one online 200 buck sure price continue sink also seemed quite good bargain amount storage space,1,positive
107,particularly like txt file record control information picture take,1,positive
108,one little minor flaw camera lens visible viewfinder detract image,0,negative
109,button phone small even small fingertip get used rather quickly,0,negative
110,fortunate get packaging still included accessory desk stand hard case belt clip wall charger etc,1,positive
111,stink ever like assumed since wrap diaper neat little cocoon,1,positive
112,luckily 3 rebate product cost nothing indeed worth nothing,1,positive
113,ripping song creating playlist could n easier,1,positive
114,subscription file still little slower transfer 10,0,negative
115,perfect phone u patience flip,1,positive
116,possibly biggest advantage player price n enough fact user replace battery opening lid popping new battery,1,positive
117,2 excellent picture quality simple use,1,positive
118,addition come sleek powerful headset,1,positive
119,take great picture,1,positive
120,button easy use easy navigate,1,positive
121,last one month rebate status showing rebate approved check delivered still waiting check,0,negative
122,printed several photo print look good screen view,1,positive
123,technical service helpful either read website charge 50 toll fee,0,negative
124,used frequently problem,1,positive
125,best part router dhaka server,1,positive
126,speakerphone option allows u long talk conveniently lying bed 38 phone lying pillow side,1,positive
127,think combination program size taking resource open close scanning every program,0,negative
128,first start saying player hardware pretty good,1,positive
129,never know champ full way tell even though particularly aesthetic making champ clear see lift lid find wad diaper must remove usually stuck inside lid bag full,0,negative
130,color screen plus polyphonic ringtones,1,positive
131,whatever negative touchy charging damage battery seriously decrease life upgrade firmware dont heed advice always plug player side cord plugging outlet side,0,negative
132,powershot g3 great camera,1,positive
133,4 megapixels enough anybody photo quality awesome,1,positive
134,well flash photo never great still lot noise,0,negative
135,3 folder created audio file,0,negative
136,best camera digital image want,1,positive
137,creative defiantly giving ipod run money device,1,positive
138,manual mode easy use fast access selection shutter speed aperture without fumble menu option,1,positive
139,one issue headphone jack unique nokia standard headphone work,0,negative
140,creative software stink,0,negative
141,read many review norton 2004 variety source cnet amazon message board came conclusion ni 04 terrible product worth update,0,negative
142,story everybody else trying get service apex nothing,0,negative
143,player 4 month happy,1,positive
144,several mp3 player past year say far best owned,1,positive
145,one bad thing though find remote control bit flimsy predict probably die player,0,negative
146,menu easy navigate button easy use,1,positive
147,im happier person discovering p button,1,positive
148,black fly wheel feel pretty cheap uncomfortable use,0,negative
149,terrible company bad product awful support,0,negative
150,customer service technical support overloaded non responsive tell quality product willingness stand behind,0,negative
151,pleased apex ad2600 play anything put drawer,1,positive
152,great price,1,positive
153,plunge lock power switch easily accessible must free hand routing,1,positive
154,manual mode feature rich wait get hang,1,positive
155,g3 feature would want semi pro pro slr good range manual option know something photography,1,positive
156,setup using cd easy learning open refrigerator door first time,1,positive
157,problem depth adjustment speed control collet tried 1 4 sleeve yet,1,positive
158,control easy use,1,positive
159,fit right pocket much easier old s30,1,positive
160,word awesome would describe camera,1,positive
161,couple time week seems cease access internet,0,negative
162,whether novice expert ease use functionality go together,1,positive
163,optical zoom work great 14x digital zoom nice addition although picture highest digital zoom little blurry,1,positive
164,lot little cute feature favorite game pim personal information manager e organizer radio,1,positive
165,ipod freeze occasionally especially annoying middle game brick,0,negative
166,base deeper high crisper,1,positive
167,gprs web access slow,0,negative
168,claim respond 24 hour period yet 2 week without reply,0,negative
169,daylight picture brilliant indoor shot good provided subject 8 foot away,1,positive
170,perfect blend accomplish task,1,positive
171,earbuds great headphone good ak studio 240 well good darn close,1,positive
172,transmission speed also quite good page loading quickly,1,positive
173,router cheapest market,0,negative
174,feature user interface,0,negative
175,imagine disappointment though zen micro proved able play mega strongest fm signal area,0,negative
176,however call constantly drop area experience mega static point dial number 6 7 time get clear line,0,negative
177,auto mode good enough shot 4300 also boast 12 versatile scene mode well manual mode though admit n played much manual,1,positive
178,purchased camera went sale minded keeping extra definitely worth,1,positive
179,many great feature bad one,1,positive
180,7 chic look good build player come compact form metal face plate,1,positive
181,b fast mediasource cd ripping take 40 second cd pentium 4 pc 2 4 hz 1gb ram 52x drive,1,positive
182,also assign special ring graphic special people call,1,positive
183,use home theater system amazing sound picture clarity unmatched,1,positive
184,another good thing camera seems introduce much le noise dark place others seen,1,positive
185,player several month read disc would recognize several disc clean read player friend season 2,0,negative
186,picture little dark sometimes,0,negative
187,battery life long enough take lot video clip play back camera lot time camera battery get little bit warm use long time normal,0,negative
188,mean short,0,negative
189,also liking gel case,0,negative
190,finger kind stubby took learn hit key without hitting adjacent one,0,negative
191,decent battery average size 40gb come dock,1,positive
192,bought trip bun aries also used iguassu fall could asked perfect performance,1,positive
193,placement button software user interface near perfect,1,positive
194,easy setup plenty power hog anything encountered,1,positive
195,sound quality superb much better ipod opinion,1,positive
196,finally read post somewhere code useless apex 2600,0,negative
197,among weak point mmc slot location bit vague design,0,negative
198,creative lab zen xtra feature pod get amazon going pay 300 great player,1,positive
199,7 picture quality excellent,1,positive
200,camera closest perfect diagram 4 5 megapixel,1,positive
201,two week picture kept freezing,0,negative
202,never odor problem,1,positive
203,total price delivery free shipping 135,1,positive
204,pretty comfortable stay place deliver decent audio quality,1,positive
205,view finder show crystal clear picture look even better get computer,1,positive
206,granted used dvd player 2 hour setting mom christmas long enough find problem dvd player,0,negative
207,price considering purchasing spare backup,1,positive
208,linksys costlier others home consumer division disco,0,negative
209,little overview powershot g3 flagship canon powershot series slr like camera 4 megapixel almost full manual control give picture touch brilliance,1,positive
210,also nomad 14 hour battery life versus 8 handy,1,positive
211,disadvantage camera trouble autofocus occasional picture especially quick candid shot start shot quick,0,negative
212,button size ok wife granny,0,negative
213,mobile service able take pic drove across 70 email family friend reached mobile tone usually major city,1,positive
214,much feature ipod except game,0,negative
215,pleased far,1,positive
216,unit well structured button need none n,1,positive
217,without tweaking exposure accurate color realistic ive ever seen produced film raw image,1,positive
218,used 35mm camera find g3 comfortable friendly use,1,positive
219,changing track information lot cd database information utilized software mediocre best,0,negative
220,ive phone year best phone owned,1,positive
221,conclusion gave ipod 4 5 anything expensive would work flawlessly,1,positive
222,searched program online tech support worthless found solution,0,negative
223,large easy readable screen,1,positive
224,best purchase made long time,1,positive
225,player looked good right box offering lot feature good styling,1,positive
226,look feel black one contrasting neon blue button add nice ambiance,1,positive
227,easy use flip lid diaper gone,1,positive
228,picture fabulous short learning curve ton feature n even gotten,1,positive
229,since small big deal bring,1,positive
230,however ultracompact allows photographer personalize shooting preference variety preset user definable mode,1,positive
231,micro seemed like ipod le,1,positive
232,biggest concern found nokia phone lower quality construction lead lower price also last long,0,negative
233,digic ii chip help lot,1,positive
234,small,1,positive
235,11 minimal pause song le device good achievement hard drive based player,1,positive
236,zen impressive purchase would highly recommend anyone using napster,1,positive
237,9 3x built optical zoom lot price range,1,positive
238,hard case give must work well,1,positive
239,many capability always room new technology evolve,1,positive
240,unfortunately wrong,0,negative
241,pleased router would buy,1,positive
242,thing experience problem player freezing playing able clear opening blowing canned air,0,negative
243,high resolution screen easy read backlight,1,positive
244,deficiency zennx easily overcome 3rd party earphone 20 software 25,0,negative
245,possibility auto manual helpful scene mode offer 11 optimized situational setting like portrait landscape beach snow sunset etc endless,1,positive
246,actually creative zen micro solves,1,positive
247,went put new sd card looked lcd screen cracked fluid gave jackson pollock type appearance screen black blue purple blotch streak useless,0,negative
248,overall disappointing product,0,negative
249,player software easy use good,1,positive
250,sound great,1,positive
251,easiest thing setup thought 16 said buy router,1,positive
252,right creative software transfer subscription music file slowly,0,negative
253,nokias always good sound quality exception,1,positive
254,second might problem might pc sure player connected usb start playing also using window explorer sometimes pause try synchronize pc play bit irritating,0,negative
255,short nokia 6600 evolution revolution,1,positive
256,eating solid odor escaping constantly using freshener,0,negative
257,like performance phone every regard would buy another one solely upon apparent indestructibility,1,positive
258,7 360 panoramic picture big deal,1,positive
259,scouring various board find arbitrary pervasive problem,0,negative
260,scroll wheel finicky work time learning curve pressing right new user say 50 75 success rate find frustrating return device,0,negative
261,amazed photo quality print indistinguishable 35mm print,1,positive
262,6610 excels cell phone thank god,1,positive
263,owned router 8 year somewhat satisfied,1,positive
264,2 storage capacity,1,positive
265,rate plan also good least,1,positive
266,long reboots due norton taking forever boot,0,negative
267,compact digital camera especially useful little child around always take camera take many picture,1,positive
268,likewise heard norton 2004 professional version fine,1,positive
269,love create custom playlist organize music many different way,1,positive
270,far durable little pad earbuds really necessary find comfortable,1,positive
271,like auto fit feature stretch wide screen dvd normal,1,positive
272,sure read spec see everything best thing easily check email movie time news website phone,1,positive
273,sometimes press button menu appears second two,0,negative
274,learn change setting make quality even better,1,positive
275,fortunately g3 hot shoe take external flash fortunately already owned one highest quality external flash money buy met 60 ct 4,1,positive
276,better camera none anywhere near light compact,1,positive
277,two limitation knew would deal long lag time focus lock even bright light unsatisfactory light quality built flash,0,negative
278,read installation instruction ni 2004 navy 2004 prior installation still ended result junk software,0,negative
279,give 4 5 star possible since 5 star would misleading give 4 star,1,positive
280,nomad zen could use little sturdier construction like archos jukebox kind shock resistant case,0,negative
281,phone big seller size fit nicely pocket without falling,1,positive
282,installation near automatic,1,positive
283,versatile seems one best,1,positive
284,however purchasing 20 gb ipod clear see superiority,1,positive
285,retraction said mine silver plate display,1,positive
286,another good feature charge battery connecting player computer using usb cable,1,positive
287,use ripping cd pretty good job,1,positive
288,done quite pleased see corner needed decently covered signal,1,positive
289,diaper champ best,1,positive
290,nice thing bit much weight power easy handheld use spindle lock make awkward bit changing outside table 1 4 chuck sleeve requires much tightening keep bit slipping,0,negative
291,giving zero star symantec version,0,negative
292,even firmware update roommate loose wireless connectivity,1,positive
293,like local station stern npr radio seemed like great option,1,positive
294,height convenient reach others hunch,1,positive
295,sent back think speed control either poorly designed defective,0,negative
296,instruction encrypt personal wireless network one else end hogging stealing bandwidth,1,positive
297,one outstanding positive feature battery hold charge long time longer similar product user replace easily take another along backup,1,positive
298,cd ripping mp3 easy even rip cd directly mp3 player wo n take space pc hard drive,1,positive
299,hand someone n yield good result idiot program auto mode,1,positive
300,removable cheap battery li battery usually work properly 1 3 year,1,positive
301,also included game section great music trivia option test skill able quickly place song,1,positive
302,second automatic sync creative let review song begin transfer,1,positive
303,left right would given better control,0,negative
304,along way compared wife t720i 6600 superior term battery life connectivity bar feature,1,positive
305,one color display like lot visual,1,positive
306,nice little phone light compact,1,positive
307,also battery user replaceable,0,negative
308,seem fewer collision dropped packet read router log old dlink router,1,positive
309,extremely glad bought camera,1,positive
310,b screen hard read cover hide already annoying poorly lit display,0,negative
311,know unit problem future 40 2 year question asked replacement warranty worth since creative warrant 90 day totally ridiculous,0,negative
312,creative lab customer support website useless,0,negative
313,far better trash diaper genie fairly inexpensive baby product go,1,positive
314,flash built flash small camera get illuminated main subject depth lost,0,negative
315,even navigate genre artist album since genre get track genre division,0,negative
316,used daily none problem reported reviewer headphone jack player locking etc,1,positive
317,anyone thinking getting ipod mini forget go player,1,positive
318,heaviest around think porter cable distinction found combination weight power really much allow precise handheld operation,0,negative
319,even viewed cd full jog,1,positive
320,lot flaw exceptional sound quality hd size price make good buy,1,positive
321,mediasource recognize tag,0,negative
322,problem found internet service access mil real estate broker software well,0,negative
323,software come player good,0,negative
324,actually purchased two phone recently one new blackberry phone one far superior imho,1,positive
325,software get camera perfect,1,positive
326,far difficult select song easy use fly playlist creation new ipod mention n since contact list phone number address book etc like ipod eliminated need kind palm device,0,negative
327,well made powerful tool,1,positive
328,could hardly use without recharge 2 day,0,negative
329,play format check buy play,1,positive
330,norton internet av 2004 terrible right get go think steelworks ok remain ok,0,negative
331,also use itunes sue dammit itunes good anything,1,positive
332,want great deal great mp3 player get nomad,1,positive
333,well within 45 day video output quit working rca optic,0,negative
334,plug play relies id3 fm recording,0,negative
335,earbud headphone really nice,1,positive
336,battery compared player market ipod one worst battery around,0,negative
337,price compared ipod great,1,positive
338,good quality video,1,positive
339,3 work automatically like hard drive connect computer like player,0,negative
340,hour start skipping like dvd dirty,0,negative
341,image quality excellent,1,positive
342,n easy fast forward pause song regular walkman,0,negative
343,dvd player work properly,0,negative
344,software great,1,positive
345,could better perfect camera competitor better purple fringing detail high light area noise iso100 red eye processing artefact loss detail especially hair people low light automatic autofocus whizzing video playback better video compression smaller viedo file manual control longer lasting battery indicator battery better protection lcd le weight,1,positive
346,hitachi made malaya looked cheap compared makita made usa,1,positive
347,software software come along intuitive used job well,0,negative
348,phone best battery last longer old 3210,1,positive
349,backlight phone go way quickly dangerous driving night way change,0,negative
350,4300 durable compact package find nikon brand trust,1,positive
351,complaint marginal one apple proprietary set music file incompatibility music service e napster right wrong,0,negative
352,screen large easily read,1,positive
353,norton online support even acknowledge problem computer company preloaded new computer,0,negative
354,built like tank yet nimble enough comfortably used leigh dovetail jig,1,positive
355,canon software raw image present raw image raw image processed image affecting setting camera,0,negative
356,come 16 mb compact flash one rechargable battery charging unit included fast small,1,positive
357,size tiny love,1,positive
